{
  "$schema": "./_schema.json",
  "name": "context-bar",
  "displayName": "컨텍스트 바 (hamzafer)",
  "summary": "컨텍스트 창을 /context와 같은 색의 구간별 막대 그래프로 표시해요. 토큰 수·압축 시점·범례도 입력창 위에서 확인할 수 있어요.",
  "summaryEn": "Your context window as a stacked bar above the prompt, colored per category as /context does, with token counts and the compaction point.",
  "category": "statusline",
  "tags": [
    "컨텍스트",
    "토큰"
  ],
  "kind": "upstream",
  "source": {
    "source": "git-subdir",
    "url": "https://github.com/hamzafer/claude-code-mods",
    "path": "mods/context-bar",
    "sha": "adf9d72d81cb04284416371f9de8a6f937dcc631"
  },
  "upstream": {
    "repo": "hamzafer/claude-code-mods",
    "path": "mods/context-bar",
    "commit": "adf9d72d81cb04284416371f9de8a6f937dcc631",
    "stars": 119
  },
  "author": {
    "name": "Hamza Zafar",
    "url": "https://github.com/hamzafer"
  },
  "license": "MIT",
  "homepage": "https://github.com/hamzafer/claude-code-mods/tree/main/mods/context-bar",
  "commands": [
    "/context-bar"
  ],
  "surfaces": [
    "terminal",
    "desktop"
  ],
  "preview": "https://raw.githubusercontent.com/hamzafer/claude-code-mods/adf9d72d81cb04284416371f9de8a6f937dcc631/images/context-bar.png",
  "notes": [
    "k-mods 자체 mod인 ctx-strip과 개념이 겹쳐요(둘 다 컨텍스트 창을 막대로 보여줌). 이름은 다르므로(string 충돌 아님) 등록은 했지만, 기계적으로는 ctx-strip이 '막대 + 서브에이전트 한 줄'을 한 번에 보여주는 반면 context-bar는 /context와 동일한 카테고리별 색상·범례·압축 임계값 표시에 집중한 순수 컨텍스트 전용 버전이라는 차이가 있어요. 최종적으로 사용자에게 둘 다 보여줄지, 하나만 추천할지는 교차 조율이 필요해 보여요."
  ],
  "review": {
    "date": "2026-10-06",
    "by": "k-mods",
    "claudeCode": "2.1.291",
    "method": [
      "validate",
      "code-read"
    ],
    "findings": [
      "validate 성공(success:true), errors/warnings 없음, gatingHooks 없음(이 mod는 세션 이벤트와 화면 그리기만 다뤄요).",
      "네트워크 목적지: 없음.",
      "외부 프로그램 실행: 없음.",
      "파일 쓰기: 없음. 숨김 여부는 $.store(isHidden)에만 저장돼요.",
      "모델 호출($.model.*): 없음. 컨텍스트 분해는 $.session.usage({breakdown:'summary'})로 Claude Code가 이미 계산해 둔 값을 그대로 읽어요(별도 토큰 계산 API 호출 없음).",
      "prompt.submit/tool.call/tool.check 훅: 등록하지 않음.",
      "env/설정/트랜스크립트 읽기: 없음.",
      "기기 밖 데이터 전송: 없음.",
      "타이머/폴링: 없음. 매 턴 종료(turn.complete)와 /compact 직후에만 다시 그려요."
    ]
  }
}
