{
  "$schema": "./_schema.json",
  "name": "secret-vault",
  "summary": "사용자가 붙여넣거나 도구가 읽어온 API 키·이메일·IP 주소를 모델에게 보내기 전 자리표시로 바꿔요. 도구 실행 직전에는 원래 값으로 되돌려줘요.",
  "summaryEn": "Hides pasted or tool-read secrets, emails and IPs with stable placeholders, restoring real values only right before a tool runs.",
  "category": "guard",
  "tags": [
    "민감정보",
    "레다크션"
  ],
  "kind": "upstream",
  "source": {
    "source": "git-subdir",
    "url": "https://github.com/ray-amjad/awesome-claude-code-function-hooks",
    "path": "plugins/secret-redactor",
    "sha": "12b5fea27a4bd1b88cd9c9b6abc1efc0756c6625"
  },
  "upstream": {
    "repo": "ray-amjad/awesome-claude-code-function-hooks",
    "path": "plugins/secret-redactor",
    "commit": "12b5fea27a4bd1b88cd9c9b6abc1efc0756c6625",
    "stars": 4
  },
  "author": {
    "name": "Ray Amjad",
    "url": "https://github.com/ray-amjad"
  },
  "license": "MIT",
  "homepage": "https://github.com/ray-amjad/awesome-claude-code-function-hooks/tree/12b5fea27a4bd1b88cd9c9b6abc1efc0756c6625/plugins/secret-redactor",
  "notes": [
    "k-mods에는 이미 davila7/claude-code-templates 출처의 'secret-redactor'(도구 결과만 가리고 재사용을 막는 방식)가 등록돼 있어요. 이 mod(원래 이름도 secret-redactor라 이름이 겹쳐 secret-vault로 등록)는 그것과 달리 prompt.submit 훅으로 사용자가 직접 붙여넣은 값도 가리고, 가린 값을 도구 실행 직전에 원래대로 복원해 워크플로를 끊지 않는 점이 달라요. 두 mod가 겹치는 영역이 있으니 마케팅/운영 쪽에서 통합 여부를 검토해 보면 좋겠어요.",
    "README에는 'CLAUDE_CODE_ENABLE_FUNCTION_HOOKS=1이 필요하다'고 적혀 있지만(초기 early-access 시절 문구로 보여요), 2.1.291에서는 별도 설정 없이 validate가 바로 통과했어요."
  ],
  "notesEn": [
    "k-mods already has 'secret-redactor' (from davila7/claude-code-templates; it hides only tool results and blocks reuse). This mod (its original name was also secret-redactor, so it is registered as secret-vault to avoid the name collision) differs in that it also hides values you paste yourself, using the prompt.submit hook, and restores the hidden values to the originals right before a tool runs, so the workflow is not interrupted. The two mods overlap in some areas, so it would be good for marketing/operations to review whether to merge them.",
    "The README says 'CLAUDE_CODE_ENABLE_FUNCTION_HOOKS=1 is required' (this looks like wording from the early-access period), but on 2.1.291 validate passed right away with no extra setup."
  ],
  "review": {
    "date": "2026-10-06",
    "by": "k-mods",
    "claudeCode": "2.1.291",
    "method": [
      "validate",
      "code-read"
    ],
    "findings": [
      "네트워크 호출 없음, 외부 프로그램 실행 없음",
      "파일 쓰기 없음. 치환 값은 세션 메모리 안의 vault에만 보관하고 디스크에 쓰지 않으며 세션 종료 시 사라져요",
      "모델 호출($.model.*) 없음. 비밀값 판별은 정규식(벤더별 키 패턴 19종) + 엔트로피 계산으로만 해요",
      "prompt.submit 훅: 사용자가 입력한 텍스트에서 비밀값·PII를 찾아 치환 후 next()로 통과(차단 아님, 변환만)",
      "tool.call 훅: 도구 입력에 들어있던 치환 자리표시를 원래 값으로 복원해 실제 명령은 정상 동작하게 하고, 도구 결과에 새로 나타난 비밀값은 다시 치환해서 반환. 역시 deny 없이 항상 통과",
      "prompt.context 훅: 첫 메시지에 붙는 CLAUDE.md 등 블록에서 비밀값만 가림(이메일은 그대로. 사용자 본인 주소라 모델이 알아야 하는 정보로 간주)",
      "세 훅 모두 .catch 없음(validate: hasCatch false). 전부 순수 정규식 치환이라 예외 발생 가능성은 낮지만, 실패 시 fail-open/closed 여부는 엔진 쪽 동작이라 코드만으로 단정할 수 없어요",
      "env·설정파일·트랜스크립트 읽기 없음, 타이머·폴링 없음",
      "명시된 최소 Claude Code 버전: 없음(README는 구버전 함수 훅 플래그를 언급하나 현재는 불필요)"
    ]
  }
}
