{
  "$schema": "./_schema.json",
  "name": "starter",
  "displayName": "추천 세트",
  "displayNameEn": "Starter Set",
  "summary": "처음 설치하기 좋은 추천 세트예요. ko-ui, skins, spinner, ctx-strip, mod-store를 한 번에 설치해요",
  "summaryEn": "The k-mods starter set: ko-ui, skins, spinner, ctx-strip and mod-store in one install",
  "category": "bundle",
  "tags": [
    "추천",
    "묶음"
  ],
  "kind": "bundle",
  "source": "./bundles/starter",
  "dependencies": [
    "ko-ui",
    "skins",
    "spinner",
    "ctx-strip",
    "mod-store"
  ],
  "author": {
    "name": "SeongGwangJu",
    "url": "https://github.com/SeongGwangJu"
  },
  "license": "MIT",
  "review": {
    "date": "2026-10-08",
    "by": "k-mods",
    "claudeCode": "2.1.294",
    "method": [
      "validate"
    ]
  }
}
