{
  "$schema": "./_schema.json",
  "name": "review-watch",
  "displayName": "리뷰 워치",
  "displayNameEn": "Review Watch",
  "summary": "실행 중인 codex review나 '리뷰' 서브에이전트마다 모델·대상·경과 시간을 한 줄로 표시해요. 끝나면 발견 항목 수를 화면 알림으로 알려줘요.",
  "summaryEn": "Shows one live line per running code review (a codex review command, or a review subagent): model, target, elapsed time, latest output.",
  "category": "statusline",
  "tags": [
    "코드리뷰",
    "codex"
  ],
  "kind": "upstream",
  "source": {
    "source": "git-subdir",
    "url": "https://github.com/hamzafer/claude-code-mods",
    "path": "mods/review-watch",
    "sha": "adf9d72d81cb04284416371f9de8a6f937dcc631"
  },
  "upstream": {
    "repo": "hamzafer/claude-code-mods",
    "path": "mods/review-watch",
    "commit": "adf9d72d81cb04284416371f9de8a6f937dcc631",
    "stars": 119
  },
  "author": {
    "name": "Hamza Zafar",
    "url": "https://github.com/hamzafer"
  },
  "license": "MIT",
  "homepage": "https://github.com/hamzafer/claude-code-mods/tree/main/mods/review-watch",
  "commands": [],
  "surfaces": [
    "terminal",
    "desktop"
  ],
  "requires": [
    "ps, tail (macOS/Linux 기본 제공)",
    "Codex CLI (선택. codex review 추적 시에만 의미 있음)"
  ],
  "requiresEn": [
    "ps, tail (included by default on macOS/Linux)",
    "Codex CLI (optional; only meaningful when tracking codex review)"
  ],
  "preview": "https://raw.githubusercontent.com/hamzafer/claude-code-mods/adf9d72d81cb04284416371f9de8a6f937dcc631/images/review-watch.png",
  "notes": [
    "저장소 설명에 'codex review 감시' 기능이 있다고 해서 codex 바이너리를 직접 실행하는지 코드로 확인했어요. 직접 실행하지 않아요. Claude가 이미 Bash로 실행한 `codex review` 명령을 ps/tail로 관찰만 하고, 실행 여부 결정이나 차단은 merge-gate(같은 저장소)의 역할이에요."
  ],
  "notesEn": [
    "The repository description mentions a 'codex review watching' feature, so we checked in the code whether it runs the codex binary itself. It does not. It only observes, with ps/tail, a `codex review` command that Claude has already run through Bash. Deciding whether to run it, or blocking it, is the role of merge-gate (same repository)."
  ],
  "review": {
    "date": "2026-10-06",
    "by": "k-mods",
    "claudeCode": "2.1.291",
    "method": [
      "validate",
      "code-read"
    ],
    "findings": [
      "validate 성공(success:true), errors/warnings 없음. gatingHooks 2건(tool.call{tool=Bash}, agent.spawn)이 .catch 없이 등록되지만, 둘 다 deny를 전혀 하지 않는 관찰용 훅이에요(라벨만 기록하고 항상 next() 통과).",
      "네트워크 목적지: 없음.",
      "외부 프로그램 실행: codex 바이너리는 직접 실행하지 않음. 대신 `ps -axww -o command=`(실행 중인 codex review 프로세스 탐지), `tail -c 40000 --/-n 30 -- <파일>`(codex가 '> file'로 적어둔 출력을 읽어 마지막 줄·발견 개수 파악), `sh -c 'grep -E \"^model *=\" \"$HOME/.codex/config.toml\" | head -n1'`(명령줄에 모델이 없을 때 설정 파일에서 기본 모델명만 읽음). 모두 읽기 전용 로컬 명령이에요.",
      "파일 쓰기: 없음.",
      "모델 호출($.model.*): 없음.",
      "tool.call{Bash}/agent.spawn 훅 동작: Bash 명령이 `codex review` 패턴에 맞으면 추적 항목을 추가하고 ps로 생사를 주기적으로 확인, description에 'review'가 들어간 서브에이전트도 같은 방식으로 추적해요. 어느 경우도 차단하지 않아요.",
      "env/설정/트랜스크립트 읽기: HOME(~/.codex/config.toml 경로용)만 읽어요. 대화 내용·세션 메시지를 읽는 코드는 없어요.",
      "기기 밖 데이터 전송: 없음.",
      "타이머/폴링: 추적 중인 리뷰가 있을 때만 3초 간격으로 ps를 폴링(겹쳐 돌지 않도록 가드 있음), 화면 갱신용 1초 타이머는 보여줄 내용이 있을 때만 동작해요."
    ]
  }
}
