{
  "$schema": "./_schema.json",
  "name": "ctx-handoff",
  "displayName": "컨텍스트 핸드오프",
  "displayNameEn": "Context Handoff",
  "summary": "컨텍스트가 한계에 가까워지면 새 대화용 핸드오프를 만들고 자동으로 전환해요. 사용자가 55분 동안 입력하지 않으면 프롬프트 캐시를 최대 3번 갱신해요.",
  "summaryEn": "Auto handoff to a fresh conversation when context hits a threshold, with idle cache refresh and background project notes while you're away.",
  "category": "automation",
  "tags": [
    "핸드오프",
    "컨텍스트",
    "메모리"
  ],
  "kind": "upstream",
  "source": {
    "source": "github",
    "repo": "cablate/ctx-handoff-mod",
    "sha": "bd3bfd2c5b86d2587ad2155be5bf5a69c4de7711"
  },
  "upstream": {
    "repo": "cablate/ctx-handoff-mod",
    "commit": "bd3bfd2c5b86d2587ad2155be5bf5a69c4de7711",
    "stars": 39
  },
  "author": {
    "name": "cablate",
    "url": "https://github.com/cablate"
  },
  "license": "MIT",
  "homepage": "https://github.com/cablate/ctx-handoff-mod",
  "commands": [
    "/handoff"
  ],
  "surfaces": [
    "terminal",
    "desktop"
  ],
  "review": {
    "date": "2026-10-06",
    "by": "k-mods",
    "claudeCode": "2.1.291",
    "method": [
      "validate",
      "code-read"
    ],
    "findings": [
      "네트워크 호출 없음($.http.fetch 미사용). 모델 호출은 Claude Code 자체 $.model.fork/$.model.complete로만 이뤄짐. 사용자 자신의 사용량 소비: (1) 컨텍스트 임계값 도달 시 핸드오프 요약 생성, (2) 유휴 55분마다 최대 3회 캐시 리프레시, (3) 사용자 메시지 30개마다 또는 핸드오프 직전 '배경 정리'로 대화 내용을 모델에 보내 프로젝트 메모(규칙/기억)로 압축.",
      "파일 쓰기: 위 '배경 정리' 결과를 <claude 설정 폴더>/projects/<워크스페이스>/memory/ctx-handoff.md에 로컬로만 저장. 기기 밖 전송 없음.",
      "비밀값 보호: 정리 결과에 금칙어 정규식(sk-, gh_, xox-, AKIA, BEGIN, password 등)이 걸리면 해당 줄 전체를 버리고 로그 샘플에도 내용을 남기지 않음.",
      "gating 훅: classic.Stop은 .catch 없이 등록되지만 함수 본문이 자체적으로 try/catch로 감싸 예외를 삼키고 로그만 남김(사실상 안전). prompt.submit도 .catch 없이 등록되나, 핸드오프 진행 중에만 메시지를 잠시 보류했다가 재전송하는 흐름 제어이며 보안 차단이 아님.",
      "env 읽기: CLAUDE_CONFIG_DIR, HOME, USERPROFILE(경로 계산용). 트랜스크립트는 $.session.messages()로 읽어 핸드오프 요약·배경 정리에만 쓰고 로컬 모델 호출·로컬 파일 저장 밖으로 나가지 않음.",
      "기기 밖 데이터 전송 없음. 무거운 타이머: $.clock.after로 유휴 55분 타이머 1개 수준, 과도하지 않음."
    ]
  }
}
