{
  "name": "cc-pr-tracker",
  "displayName": "GitHub PR 트래커",
  "summary": "머지 상태·리뷰·필수 체크를 입력창 위에서 실시간으로 지켜보고, 바뀌면 토스트·소리로 알려줘요.",
  "summaryEn": "Watches GitHub PRs from your session—merge state, review, and required checks above the prompt—with alerts when they change.",
  "category": "integration",
  "tags": [
    "GitHub",
    "PR",
    "CI",
    "알림"
  ],
  "kind": "upstream",
  "source": {
    "source": "github",
    "repo": "sezaakgun/cc-pr-tracker",
    "sha": "605b8fc515c3b4842b3b3b15c9757ae5bc351b86"
  },
  "upstream": {
    "repo": "sezaakgun/cc-pr-tracker",
    "commit": "605b8fc515c3b4842b3b3b15c9757ae5bc351b86",
    "stars": 5
  },
  "author": {
    "name": "Seza Akgün",
    "url": "https://github.com/sezaakgun"
  },
  "license": "MIT",
  "homepage": "https://github.com/sezaakgun/cc-pr-tracker",
  "surfaces": [
    "terminal",
    "desktop"
  ],
  "requires": [
    "gh CLI 설치 및 로그인"
  ],
  "notes": [
    "GitHub 접근은 전부 사용자의 `gh` CLI 인증을 그대로 써요. 별도 토큰을 저장하지 않아요.",
    "체크 이름·PR 제목처럼 GitHub에서 온 텍스트는 제어문자를 제거하고, Claude에게 보내는 알림 문구는 '자동 생성된 데이터'라고 명시해서 프롬프트 주입을 막아요.",
    "cmux라는 특정 환경(CMUX_BUNDLED_CLI_PATH 등)에서만 추가 알림을 보내고, 없으면 조용히 건너뛰어요.",
    "notifyClaude 설정이 켜져 있으면(기본값) PR 상태가 바뀔 때 Claude가 다음 턴에 읽는 안내 메시지를 대화에 추가해요. 끄려면 /config에서 notifyClaude를 꺼요."
  ],
  "review": {
    "date": "2026-10-06",
    "by": "k-mods",
    "claudeCode": "2.1.291",
    "method": [
      "validate",
      "code-read"
    ],
    "findings": [
      "validate 통과. config.set·prompt.submit·tool.call{pr_status}·tool.call{Bash} 4개가 .catch 없이 플래그됐지만, 코드 확인 결과 config.set은 next(e)가 이미 거부(deny)했으면 그대로 반환하고, pr_status는 자신이 등록한 합성 도구에 응답하며, Bash는 실행 후 결과만 관찰함. 실제 차단 로직 없음. prompt.submit은 'PR URL만 있는 프롬프트'를 모델 호출 없이 감시 토글로 흡수하는 의도된 UX.",
      "유일한 네트워크 접근은 사용자의 `gh` CLI를 통한 GitHub GraphQL 호출(`gh api graphql`). owner/repo/PR번호만 변수로 보내고 별도 토큰 저장이나 다른 목적지로의 전송이 없음.",
      "cmux(CMUX_BUNDLED_CLI_PATH/CMUX_SURFACE_ID)·afplay(macOS 소리)·open/xdg-open(브라우저 열기)은 전부 로컬 실행이며, cmux 환경 변수 둘 다 없으면 완전히 no-op.",
      "$.session.append로 PR 상태 변화를 Claude가 읽는 user-role 메시지를 추가함. GitHub 체크 이름 등 외부 데이터는 JSON 문자열로 인용하고 '자동 생성, 사용자가 쓴 게 아님'이라고 명시해 체크 이름을 통한 프롬프트 주입을 방어함(changeNote 함수, 코드 주석으로 의도 확인).",
      "체크·PR 제목의 제어문자를 clean()으로 제거하고 링크는 linkable()로 https(또는 http+localhost)만 허용. 공격받은 PR의 CI 데이터를 신뢰하지 않는 신중한 설계.",
      "$.state/$.ui.copy/$.session.root/$.session.append가 없는 구버전 Claude Code에서는 조용히 감지해 메모리 전용으로 계속 동작(attempt 래퍼)."
    ]
  }
}
