{
  "$schema": "./_schema.json",
  "name": "status-ko",
  "displayName": "작업 상태 한국어",
  "summary": "작업 중 줄을 '읽는 중 · page.tsx'처럼 지금 하는 일로, 끝난 줄을 모델·시간·도구·캐시 한 줄로 보여줘요",
  "summaryEn": "Spinner shows what Claude is doing now in Korean; the turn footer becomes one line of model, time, tools and cache hit",
  "category": "statusline",
  "tags": [
    "한국어",
    "스피너",
    "상태줄"
  ],
  "kind": "original",
  "source": "./mods/status-ko",
  "author": {
    "name": "SeongGwangJu",
    "url": "https://github.com/SeongGwangJu"
  },
  "license": "MIT",
  "commands": [],
  "surfaces": [
    "terminal"
  ],
  "featured": true,
  "review": {
    "date": "2026-10-06",
    "by": "k-mods",
    "claudeCode": "2.1.291",
    "method": [
      "validate",
      "code-read",
      "unit-test",
      "live-session"
    ]
  }
}
